[
{
"date": "22 Jun 2026",
"edition": "22 June 2026",
"cat": "Politics",
"title": "Starmer announces resignation as UK prime minister; Labour to choose a successor by 1 September",
"summary": "Keir Starmer said on Monday he will step down as Labour leader and prime minister, triggering a leadership process with nominations opening on 9 July; Andy Burnham is the reported front-runner. Sterling held lower and gilt yields edged up.",
"panel": "starmer"
},
{
"date": "22 Jun 2026",
"edition": "22 June 2026",
"cat": "Politics",
"title": "US and Iran conclude first Switzerland session; mediators report ‘encouraging progress’ on sanctions and Hormuz",
"summary": "US and Iranian delegations wrapped up the first session of talks in Switzerland, with mediators Qatar and Pakistan reporting ‘encouraging progress’; Iranian officials said draft oil-sanctions waivers and the release of frozen assets were discussed, and technical teams will continue this week.",
"panel": "iran"
},
{
"date": "22 Jun 2026",
"edition": "22 June 2026",
"cat": "Politics",
"title": "Italy's Meloni rejects Trump's ‘fabricated’ G7 account; foreign minister Tajani cancels US trip",
"summary": "Italian Prime Minister Giorgia Meloni called ‘completely fabricated’ a claim by President Trump that she had begged him for a photo at the G7 summit; Foreign Minister Antonio Tajani cancelled a US visit, in a public rift between the two governments.",
"panel": "italy"
},
{
"date": "22 Jun 2026",
"edition": "22 June 2026",
"cat": "Politics",
"title": "Poland strips Zelensky of its highest honour over UPA military unit; Ukraine returns the award",
"summary": "Polish President Nawrocki revoked Ukrainian President Zelensky's Order of the White Eagle after a Ukrainian unit was named for the WWII-era UPA; Zelensky and several officials returned Polish honours.",
"panel": "poland"
},
{
"date": "22 Jun 2026",
"edition": "22 June 2026",
"cat": "Health",
"title": "WHO warns of “missing” Ebola cases in DR Congo as official tallies diverge across agencies",
"summary": "A month into the Bundibugyo-virus outbreak, the WHO says it is still missing cases amid intense community transmission, while WHO, the CDC and the ECDC publish materially different case counts.",
"panel": "ebola"
},
{
"date": "22 Jun 2026",
"edition": "22 June 2026",
"cat": "Business",
"title": "Japan proposes G7 jointly stockpile critical minerals; leaders set a 60% cap on reliance on any single supplier",
"summary": "Prime Minister Sanae Takaichi pitched a G7 \"Joint Stockpiling Cooperation Initiative\" at the Evian summit, where leaders agreed to cut dependence on any single non-G7 supplier of rare earths to below 60% by 2030.",
"panel": "rareearth"
},
{
"date": "22 Jun 2026",
"edition": "22 June 2026",
"cat": "Science",
"title": "Aarhus researchers report intense UV light can break down PFAS without added chemicals",
"summary": "A lab study at Aarhus University finds that hydrogen radicals released from water by short-wavelength UV light can strip fluorine from PFAS “forever chemicals,” though degradation is partial and slow.",
"panel": "pfas"
},
{
"date": "22 Jun 2026",
"edition": "22 June 2026",
"cat": "Health",
"title": "Review concludes nicotine vapes are likely to cause lung and oral cancer",
"summary": "A qualitative risk assessment led by UNSW Sydney in the journal Carcinogenesis judges nicotine e-cigarettes likely carcinogenic, while several outside experts call the conclusion an overinterpretation of the evidence.",
"panel": "vapes"
},
{
"date": "22 Jun 2026",
"edition": "22 June 2026",
"cat": "Markets",
"title": "Stocks mixed as Starmer resigns and US–Iran talks conclude; oil slips below $79",
"summary": "European shares were modestly higher and the pound held lower after UK PM Keir Starmer announced his resignation, while US futures slipped on renewed Iran threats; Brent fell below $79 as the first Switzerland session ended with ‘encouraging progress.’",
"panel": "markets"
},
{
"date": "21 Jun 2026",
"edition": "21 June 2026",
"cat": "Politics",
"title": "Iran says it has re-closed the Strait of Hormuz; Switzerland talks postponed",
"summary": "After an Israeli strike on Lebanon, Iran says it has again closed the strait and the US–Iran talks are postponed — the week-old memorandum under strain."
},
{
"date": "21 Jun 2026",
"edition": "21 June 2026",
"cat": "Politics",
"title": "Burnham wins Makerfield; a Labour leadership contest opens",
"summary": "The Manchester mayor took the seat with about 55% and is expected to press Starmer to stand aside."
},
{
"date": "21 Jun 2026",
"edition": "21 June 2026",
"cat": "Conflict",
"title": "Ukraine strikes Crimea-bridge approaches overnight; trackers still disagree",
"summary": "Drones hit the Kerch and Kavkaz ports on 21 June; DeepState and ISW give opposite readings of who is gaining ground."
},
{
"date": "21 Jun 2026",
"edition": "21 June 2026",
"cat": "Conflict",
"title": "The ceasefire's weakest link: Israel and Lebanon",
"summary": "An Israeli strike on Lebanon on Saturday became the flashpoint that pushed Iran to re-close the strait and stall the talks."
},
{
"date": "21 Jun 2026",
"edition": "21 June 2026",
"cat": "Health",
"title": "Congo Ebola: 896 cases, 232 deaths, a global emergency",
"summary": "The WHO's highest alert is in force; the Bundibugyo strain still has no licensed vaccine."
},
{
"date": "21 Jun 2026",
"edition": "21 June 2026",
"cat": "Business",
"title": "AI labs step onto the world stage: G7 debut, Seoul office, new benchmark",
"summary": "Altman, Amodei and Hassabis appeared together at the G7; Anthropic opened a Seoul office and its Fable 5 model topped a hard-maths benchmark."
},
{
"date": "21 Jun 2026",
"edition": "21 June 2026",
"cat": "Science",
"title": "CERN completes the doubly-charmed baryon family",
"summary": "Physicists report the third and final member, a confirmation of the Standard Model."
},
{
"date": "21 Jun 2026",
"edition": "21 June 2026",
"cat": "Science",
"title": "A California fault is more stressed than in 1,000 years",
"summary": "Researchers describe an 'earthquake gate' on a system overdue for a major rupture."
},
{
"date": "21 Jun 2026",
"edition": "21 June 2026",
"cat": "Markets",
"title": "A hawkish Fed reset the week before the holiday lull",
"summary": "Markets were shut Friday for Juneteenth; the story remains Warsh's pivot toward a 2026 hike."
},
{
"date": "18 Jun 2026",
"edition": "18 June 2026",
"cat": "Politics",
"title": "US and Iran sign the deal: ceasefire locked in, Hormuz blockade lifted",
"summary": "Presidents Trump and Pezeshkian signed a memorandum — at Versailles and in Tehran — to halt fighting on all fronts and reopen the strait."
},
{
"date": "18 Jun 2026",
"edition": "18 June 2026",
"cat": "Conflict",
"title": "Ukraine sets a Moscow refinery ablaze in record drone strike",
"summary": "Fires nine miles from the Kremlin; 500+ flights disrupted; Zelensky says it is time the war ended."
},
{
"date": "18 Jun 2026",
"edition": "18 June 2026",
"cat": "Business",
"title": "Warsh's Fed turns hawkish — a 2026 hike now on the table",
"summary": "Rates held at 3.50–3.75%, but the easing bias is gone; nine of eighteen officials see a hike."
},
{
"date": "18 Jun 2026",
"edition": "18 June 2026",
"cat": "Business",
"title": "SpaceX buys Cursor maker Anysphere for $60bn",
"summary": "SpaceX stock rose 17% and vaulted above Amazon and Microsoft to the fourth most valuable US firm."
},
{
"date": "18 Jun 2026",
"edition": "18 June 2026",
"cat": "Politics",
"title": "Hegseth announces 'NATO 3.0' and a review of US forces in Europe",
"summary": "The defense chief calls allies shameful as a six-month posture review begins."
},
{
"date": "18 Jun 2026",
"edition": "18 June 2026",
"cat": "Politics",
"title": "Burnham wins Makerfield, setting up a Starmer showdown",
"summary": "The Manchester mayor's by-election win opens a Labour leadership fight; Starmer vows to stay."
},
{
"date": "18 Jun 2026",
"edition": "18 June 2026",
"cat": "Health",
"title": "Congo Ebola passes 830 cases as WHO warns of worst-ever risk",
"summary": "Nearly 200 dead; the Bundibugyo strain still has no licensed vaccine."
},
{
"date": "18 Jun 2026",
"edition": "18 June 2026",
"cat": "Science",
"title": "Scientists map the planet's hidden fungal 'superhighway'",
"summary": "Underground networks moving about four billion tonnes of CO2 into soils a year, mapped for the first time."
},
{
"date": "18 Jun 2026",
"edition": "18 June 2026",
"cat": "Technology",
"title": "G7 courts the AI chiefs as enterprise adoption accelerates",
"summary": "Altman, Amodei and Hassabis join a G7 governance lunch in France."
},
{
"date": "18 Jun 2026",
"edition": "18 June 2026",
"cat": "Markets",
"title": "Stocks rebound after the Fed shock; oil steadies near $78",
"summary": "Nasdaq +1.91%, Russell 2000 +2.12%; Brent around $79 as the blockade ends."
},
{
"date": "15 Jun 2026",
"edition": "15 June 2026",
"cat": "Conflict",
"title": "US and Iran reach initial deal to end war and reopen the Strait of Hormuz",
"summary": "A memorandum of understanding extends the fragile ceasefire by 60 days and reopens the strait."
},
{
"date": "15 Jun 2026",
"edition": "15 June 2026",
"cat": "Conflict",
"title": "Russian barrage sets Kyiv's thousand-year-old Lavra ablaze",
"summary": "At least 11 killed nationwide; 70 missiles and 611 drones launched overnight."
},
{
"date": "15 Jun 2026",
"edition": "15 June 2026",
"cat": "Business",
"title": "SpaceX completes the largest IPO in history",
"summary": "$75bn raised; shares add another 20% on Monday, with market cap above $2tn."
},
{
"date": "15 Jun 2026",
"edition": "15 June 2026",
"cat": "Health",
"title": "Ebola accelerates in DR Congo: 782 cases, 181 deaths",
"summary": "The Bundibugyo strain has no licensed vaccine; the WHO seeks $518m."
},
{
"date": "15 Jun 2026",
"edition": "15 June 2026",
"cat": "Climate",
"title": "Europe reels from 'exceptionally early' heat as AMOC watch grows",